{
 "v": 1,
 "job_id": "20261001-101500-0a1b2c3d",
 "shortcode": "DEMO0000001",
 "framing": "predicted average-brain response",
 "masks_version": "masks-v1",
 "precision": null,
 "time_s": [0.0,1.0,2.0,3.0,4.0,5.0,6.0,7.0,8.0,9.0,10.0,11.0,12.0,13.0,14.0,15.0,16.0,17.0,18.0,19.0,20.0,21.0,22.0,23.0,24.0,25.0,26.0,27.0,28.0,29.0,30.0,31.0,32.0,33.0,34.0,35.0,36.0,37.0,38.0,39.0,40.0,41.0],
 "scale": {
  "mode": "within-reel",
  "label": "one colour scale for this whole reel",
  "vmax": 0.3457,
  "percentile": 99,
  "pooled": "every cortex vertex, every second",
  "levels": 127,
  "colormap": "PuOr_r",
  "grey_below": 0.15,
  "full_at": 0.5,
  "clipped_share": 0.0099
 },
 "frames": {
  "key": "tribe/20261001-101500-0a1b2c3d/frames.i8",
  "sha256": "428a6f367cb0f1788f38c8b1abd630b07e8a5880a682355eb854e01355aaf1da",
  "bytes": 860344
 },
 "mesh": {
  "key": "shared/fsaverage5-inflated-v1.bin",
  "sha256": "2667ac2ca185ff01209e79e028cc5c37ed6d54d7633eebfdfc1dee2666b8c1a1",
  "bytes": 573520
 },
 "atlas": {
  "key": "shared/atlas-v1.bin",
  "sha256": "281d6a774e9bef0b19e8e2908982751f709d7c7e1ec828a2ea1d7e32c4882ad2",
  "bytes": 40984,
  "version": "atlas-v1",
  "hcp": {
   "name": "HCP-MMP1.0 (Glasser et al., 2016)",
   "labels": [
    "V1",
    "MST",
    "V6",
    "V2",
    "V3",
    "V4",
    "V8",
    "4",
    "3b",
    "FEF",
    "PEF",
    "55b",
    "V3A",
    "RSC",
    "POS2",
    "V7",
    "IPS1",
    "FFC",
    "V3B",
    "LO1",
    "LO2",
    "PIT",
    "MT",
    "A1",
    "PSL",
    "SFL",
    "PCV",
    "STV",
    "7Pm",
    "7m",
    "POS1",
    "23d",
    "v23ab",
    "d23ab",
    "31pv",
    "5m",
    "5mv",
    "23c",
    "5L",
    "24dd",
    "24dv",
    "7AL",
    "SCEF",
    "6ma",
    "7Am",
    "7PL",
    "7PC",
    "LIPv",
    "VIP",
    "MIP",
    "1",
    "2",
    "3a",
    "6d",
    "6mp",
    "6v",
    "p24pr",
    "33pr",
    "a24pr",
    "p32pr",
    "a24",
    "d32",
    "8BM",
    "p32",
    "10r",
    "47m",
    "8Av",
    "8Ad",
    "9m",
    "8BL",
    "9p",
    "10d",
    "8C",
    "44",
    "45",
    "47l",
    "a47r",
    "6r",
    "IFJa",
    "IFJp",
    "IFSp",
    "IFSa",
    "p9-46v",
    "46",
    "a9-46v",
    "9-46d",
    "9a",
    "10v",
    "a10p",
    "10pp",
    "11l",
    "13l",
    "OFC",
    "47s",
    "LIPd",
    "6a",
    "i6-8",
    "s6-8",
    "43",
    "OP4",
    "OP1",
    "OP2-3",
    "52",
    "RI",
    "PFcm",
    "PoI2",
    "TA2",
    "FOP4",
    "MI",
    "Pir",
    "AVI",
    "AAIC",
    "FOP1",
    "FOP3",
    "FOP2",
    "PFt",
    "AIP",
    "EC",
    "PreS",
    "H",
    "ProS",
    "PeEc",
    "STGa",
    "PBelt",
    "A5",
    "PHA1",
    "PHA3",
    "STSda",
    "STSdp",
    "STSvp",
    "TGd",
    "TE1a",
    "TE1p",
    "TE2a",
    "TF",
    "TE2p",
    "PHT",
    "PH",
    "TPOJ1",
    "TPOJ2",
    "TPOJ3",
    "DVT",
    "PGp",
    "IP2",
    "IP1",
    "IP0",
    "PFop",
    "PF",
    "PFm",
    "PGi",
    "PGs",
    "V6A",
    "VMV1",
    "VMV3",
    "PHA2",
    "V4t",
    "FST",
    "V3CD",
    "LO3",
    "VMV2",
    "31pd",
    "31a",
    "VVC",
    "25",
    "s32",
    "pOFC",
    "PoI1",
    "Ig",
    "FOP5",
    "p10p",
    "p47r",
    "TGv",
    "MBelt",
    "LBelt",
    "A4",
    "STSva",
    "TE1m",
    "PI",
    "a32pr",
    "p24"
   ],
   "network": [1,1,1,1,1,1,1,1,1,1,1,1,1,1,1,1,1,1,1,1,1,1,1,1,1,1,2,2,2,2,2,2,2,2,2,2,2,2,2,2,2,2,2,2,2,2,2,2,2,2,2,2,3,3,3,3,3,3,3,3,3,3,3,3,3,3,3,3,3,3,3,3,3,3,3,3,3,3,4,4,4,4,4,4,4,4,4,4,4,4,4,4,4,4,4,4,4,4,4,4,4,4,4,5,5,5,5,5,5,5,5,5,5,5,5,5,5,5,5,5,5,5,5,5,5,5,5,5,5,6,6,6,6,6,6,6,6,6,6,6,6,6,6,6,6,6,6,6,6,6,6,6,6,6,6,7,7,7,7,7,7,7,7,7,7,7,7,7,7,7,7,7,7,7,7,7,7,7,7,7],
   "line": [
    "seeing",
    "seeing",
    "seeing",
    "seeing",
    "seeing",
    "seeing",
    null,
    null,
    null,
    "attention",
    null,
    "language",
    "seeing",
    null,
    null,
    null,
    null,
    null,
    "seeing",
    null,
    null,
    null,
    "seeing",
    "hearing",
    "language",
    "language",
    null,
    null,
    null,
    null,
    null,
    null,
    null,
    null,
    null,
    null,
    null,
    null,
    null,
    null,
    null,
    null,
    null,
    null,
    null,
    null,
    null,
    "attention",
    "attention",
    "attention",
    null,
    null,
    null,
    null,
    null,
    null,
    null,
    null,
    null,
    null,
    null,
    null,
    null,
    null,
    null,
    null,
    null,
    null,
    null,
    null,
    null,
    null,
    null,
    "language",
    "language",
    null,
    null,
    null,
    "attention",
    "attention",
    null,
    "language",
    null,
    null,
    null,
    null,
    null,
    null,
    null,
    null,
    null,
    null,
    null,
    null,
    "attention",
    null,
    null,
    null,
    null,
    null,
    null,
    null,
    null,
    null,
    null,
    null,
    null,
    null,
    null,
    null,
    null,
    null,
    null,
    null,
    null,
    null,
    "attention",
    null,
    null,
    null,
    null,
    null,
    "language",
    "hearing",
    "language",
    null,
    null,
    null,
    "language",
    "language",
    null,
    "language",
    null,
    null,
    null,
    null,
    null,
    null,
    "attention",
    "attention",
    null,
    null,
    null,
    "attention",
    "attention",
    "attention",
    null,
    null,
    "attention",
    null,
    null,
    "seeing",
    null,
    null,
    null,
    null,
    null,
    null,
    null,
    null,
    null,
    null,
    null,
    null,
    null,
    null,
    null,
    null,
    null,
    null,
    null,
    null,
    "hearing",
    "hearing",
    "hearing",
    null,
    null,
    null,
    null,
    null
   ],
   "n_left": [56,56,56,56,56,56,56,56,56,56,56,56,55,55,55,55,55,55,55,55,55,55,55,55,55,55,55,55,55,55,55,55,55,55,55,55,55,55,55,55,55,55,55,55,55,55,55,55,55,55,55,55,55,55,55,55,55,55,55,55,55,55,55,55,55,55,55,55,55,55,55,55,55,55,55,55,55,55,55,55,55,55,55,55,55,55,55,55,55,55,55,55,55,55,55,55,55,55,55,55,55,55,55,55,55,55,55,55,55,55,55,55,55,55,55,55,55,55,55,55,55,55,55,55,55,55,55,55,55,55,55,55,55,55,55,55,55,55,55,55,55,55,55,55,55,55,55,55,55,55,55,55,55,55,55,55,55,55,55,55,55,55,55,55,55,55,55,55,55,55,55,55,55,55,55,55,55,55,55,55],
   "n_right": [56,56,56,56,56,56,56,56,56,56,56,56,55,55,55,55,55,55,55,55,55,55,55,55,55,55,55,55,55,55,55,55,55,55,55,55,55,55,55,55,55,55,55,55,55,55,55,55,55,55,55,55,55,55,55,55,55,55,55,55,55,55,55,55,55,55,55,55,55,55,55,55,55,55,55,55,55,55,55,55,55,55,55,55,55,55,55,55,55,55,55,55,55,55,55,55,55,55,55,55,55,55,55,55,55,55,55,55,55,55,55,55,55,55,55,55,55,55,55,55,55,55,55,55,55,55,55,55,55,55,55,55,55,55,55,55,55,55,55,55,55,55,55,55,55,55,55,55,55,55,55,55,55,55,55,55,55,55,55,55,55,55,55,55,55,55,55,55,55,55,55,55,55,55,55,55,55,55,55,55]
  },
  "yeo": {
   "name": "Yeo-7 networks (Yeo et al., 2011)",
   "labels": [
    "Yeo network 1: Visual",
    "Yeo network 2: Somatomotor",
    "Yeo network 3: Dorsal Attention",
    "Yeo network 4: Salience / Ventral Attention",
    "Yeo network 5: Limbic",
    "Yeo network 6: Control",
    "Yeo network 7: Default"
   ]
  },
  "order": [0,1,2,3,4,5,6,7,8,9,10,11,12,13,14,15,16,17,18,19,20,21,22,23,24,25,26,27,28,29,30,31,32,33,34,35,36,37,38,39,40,41,42,43,44,45,46,47,48,49,50,51,52,53,54,55,56,57,58,59,60,61,62,63,64,65,66,67,68,69,70,71,72,73,74,75,76,77,78,79,80,81,82,83,84,85,86,87,88,89,90,91,92,93,94,95,96,97,98,99,100,101,102,103,104,105,106,107,108,109,110,111,112,113,114,115,116,117,118,119,120,121,122,123,124,125,126,127,128,129,130,131,132,133,134,135,136,137,138,139,140,141,142,143,144,145,146,147,148,149,150,151,152,153,154,155,156,157,158,159,160,161,162,163,164,165,166,167,168,169,170,171,172,173,174,175,176,177,178,179]
 },
 "areas": {
  "hcp_left": [
   [0.1278,0.1793,0.2143,0.2307,0.2282,0.2077,0.1719,0.1243,0.0696,0.0129,-0.0406,-0.0861,-0.1198,-0.1386,-0.141,-0.1271,-0.0982,-0.0573,-0.0082,0.0443,0.0952,0.1395,0.1725,0.1906,0.1914,0.1739,0.1385,0.0874,0.0238,-0.0478,-0.1222,-0.1939,-0.2577,-0.3087,-0.3431,-0.3583,-0.3534,-0.3288,-0.2865,-0.23,-0.1636,-0.0925],
   [0.2287,0.2778,0.3088,0.3195,0.3097,0.2805,0.2344,0.1754,0.1084,0.0385,-0.0287,-0.0882,-0.1357,-0.168,-0.1832,-0.181,-0.1626,-0.1306,-0.0885,-0.041,0.0072,0.051,0.0861,0.1087,0.1166,0.1085,0.0848,0.0474,-0.0006,-0.055,-0.111,-0.1635,-0.2074,-0.2385,-0.2532,-0.2496,-0.227,-0.1862,-0.1297,-0.0611,0.0147,0.0924],
   [0.2962,0.3351,0.3543,0.3523,0.3289,0.2856,0.2255,0.1529,0.073,-0.0085,-0.0857,-0.1531,-0.2063,-0.2416,-0.2572,-0.2525,-0.2287,-0.1883,-0.1352,-0.0741,-0.0102,0.0513,0.1054,0.1481,0.1762,0.1883,0.1841,0.1648,0.1331,0.0926,0.0477,0.0032,-0.0363,-0.0667,-0.0846,-0.0879,-0.076,-0.0494,-0.0103,0.0379,0.0912,0.1445],
   [0.2228,0.2475,0.2527,0.2374,0.202,0.1485,0.0804,0.0025,-0.0798,-0.1603,-0.2333,-0.2933,-0.3357,-0.3574,-0.3568,-0.3339,-0.2904,-0.2295,-0.1558,-0.0747,0.0078,0.0858,0.1536,0.2067,0.2415,0.256,0.2498,0.2241,0.1817,0.1264,0.063,-0.0032,-0.0668,-0.1229,-0.1673,-0.1971,-0.2105,-0.2073,-0.1887,-0.1574,-0.1168,-0.0712],
   [0.1947,0.2088,0.2059,0.1855,0.1484,0.0969,0.0345,-0.0341,-0.1035,-0.1683,-0.223,-0.2631,-0.2848,-0.2858,-0.2654,-0.2247,-0.1661,-0.0937,-0.0127,0.071,0.1512,0.2218,0.2774,0.3137,0.3279,0.3186,0.2866,0.234,0.1646,0.0837,-0.0028,-0.0887,-0.1675,-0.2335,-0.2821,-0.3098,-0.315,-0.2976,-0.2593,-0.2034,-0.1345,-0.0579],
   [0.1492,0.1734,0.1822,0.1741,0.1489,0.1081,0.0546,-0.0076,-0.0736,-0.1382,-0.1961,-0.2425,-0.2732,-0.2855,-0.2779,-0.2507,-0.2054,-0.1452,-0.0744,0.002,0.0785,0.1496,0.2103,0.2566,0.2854,0.2953,0.2863,0.2601,0.2195,0.1687,0.1123,0.0557,0.0039,-0.0386,-0.068,-0.0819,-0.0793,-0.0606,-0.0277,0.016,0.0665,0.1188],